{
  "schema_version": "run-config-v1",
  "control_mode": {
    "validation_profile": "strict",
    "allow_threshold_decoupling": false,
    "allow_weight_auto_normalization": false
  },
  "user_context": {
    "user_id": null
  },
  "input_scope": {
    "source_family": "spotify_api_export",
    "include_top_tracks": true,
    "top_time_ranges": [
      "short_term",
      "medium_term",
      "long_term"
    ],
    "include_saved_tracks": true,
    "saved_tracks_limit": null,
    "include_playlists": true,
    "playlists_limit": null,
    "playlist_items_per_playlist_limit": null,
    "include_recently_played": true,
    "recently_played_limit": 50
  },
  "interaction_scope": {
    "include_interaction_types": [
      "history",
      "influence"
    ]
  },
  "influence_tracks": {
    "enabled": true,
    "track_ids": [
      "tzgGpQrOrdyACAvN",
      "PgdjI4bos3cQlF0H",
      "STQQY9CB4ccv4qWQ"
    ],
    "preference_weight": 1.0,
    "source": null
  },
  "seed_controls": {
    "match_rate_min_threshold": 0.15,
    "decay_half_lives": {
      "recently_played": 90.0,
      "saved_tracks": 365.0
    }
  },
  "profile_controls": {
    "top_tag_limit": 10,
    "top_genre_limit": 10,
    "top_lead_genre_limit": 10
  },
  "retrieval_controls": {
    "profile_top_tag_limit": 10,
    "profile_top_genre_limit": 8,
    "profile_top_lead_genre_limit": 6,
    "semantic_strong_keep_score": 3,
    "semantic_min_keep_score": 1,
    "numeric_support_min_pass": 4,
    "numeric_thresholds": {
      "danceability": 0.15,
      "energy": 0.15,
      "valence": 0.15,
      "tempo": 15.0,
      "key": 1.5,
      "mode": 0.5,
      "duration_ms": 30000.0
    }
  },
  "scoring_controls": {
    "component_weights": {
      "danceability": 0.04,
      "energy": 0.03,
      "valence": 0.03,
      "tempo": 0.03,
      "duration_ms": 0.02,
      "key": 0.02,
      "mode": 0.01,
      "lead_genre": 0.29,
      "genre_overlap": 0.24,
      "tag_overlap": 0.29
    },
    "numeric_thresholds": {
      "danceability": 0.15,
      "energy": 0.15,
      "valence": 0.15,
      "tempo": 15.0,
      "key": 1.5,
      "mode": 0.5,
      "duration_ms": 30000.0
    },
    "apply_bl003_influence_tracks": true,
    "influence_track_bonus_scale": 0.5
  },
  "assembly_controls": {
    "target_size": 10,
    "min_score_threshold": 0.35,
    "max_per_genre": 4,
    "max_consecutive": 2,
    "influence_policy_mode": "reserved_slots",
    "influence_reserved_slots": 3,
    "influence_allow_genre_cap_override": false,
    "influence_allow_consecutive_override": false,
    "influence_allow_score_threshold_override": false
  },
  "transparency_controls": {
    "top_contributor_limit": 3,
    "blend_primary_contributor_on_near_tie": true,
    "primary_contributor_tie_delta": 0.09
  },
  "observability_controls": {
    "diagnostic_sample_limit": 5,
    "bootstrap_mode": true
  }
}
