{
  "schema_version": "run-config-v1",
  "control_mode": {
    "validation_profile": "strict",
    "allow_threshold_decoupling": false,
    "allow_weight_auto_normalization": false
  },
  "user_context": {
    "user_id": null
  },
  "input_scope": {
    "source_family": "spotify_api_export",
    "include_top_tracks": true,
    "top_time_ranges": [
      "short_term",
      "medium_term",
      "long_term"
    ],
    "include_saved_tracks": true,
    "saved_tracks_limit": null,
    "include_playlists": true,
    "playlists_limit": null,
    "playlist_items_per_playlist_limit": null,
    "include_recently_played": true,
    "recently_played_limit": 50
  },
  "interaction_scope": {
    "include_interaction_types": [
      "history",
      "influence"
    ]
  },
  "influence_tracks": {
    "enabled": true,
    "track_ids": [],
    "preference_weight": 1.0,
    "source": null
  },
  "seed_controls": {
    "match_rate_min_threshold": 0.15,
    "match_rate_min_threshold_comment": "UI-013 canonical tuning baseline. Keep at 0.15 for sweep comparability; adjust upward only with demonstrated stable pass margin."
  },
  "profile_controls": {
    "top_tag_limit": 10,
    "top_genre_limit": 10,
    "top_lead_genre_limit": 10
  },
  "retrieval_controls": {
    "profile_top_tag_limit": 10,
    "profile_top_genre_limit": 8,
    "profile_top_lead_genre_limit": 6,
    "semantic_strong_keep_score": 2,
    "semantic_min_keep_score": 1,
    "numeric_support_min_pass": 1,
    "numeric_thresholds": {
      "danceability": 0.2,
      "energy": 0.2,
      "valence": 0.2,
      "tempo": 20.0,
      "key": 2.0,
      "mode": 0.5,
      "duration_ms": 45000.0
    }
  },
  "scoring_controls": {
    "component_weights": {
      "danceability": 0.1,
      "energy": 0.1,
      "valence": 0.08,
      "tempo": 0.1,
      "duration_ms": 0.07,
      "key": 0.06,
      "mode": 0.04,
      "lead_genre": 0.17,
      "genre_overlap": 0.12,
      "tag_overlap": 0.16
    },
    "numeric_thresholds": {
      "danceability": 0.2,
      "energy": 0.2,
      "valence": 0.2,
      "tempo": 20.0,
      "key": 2.0,
      "mode": 0.5,
      "duration_ms": 45000.0
    }
  },
  "assembly_controls": {
    "target_size": 10,
    "min_score_threshold": 0.35,
    "max_per_genre": 4,
    "max_consecutive": 2
  },
  "transparency_controls": {
    "top_contributor_limit": 3
  },
  "observability_controls": {
    "diagnostic_sample_limit": 5,
    "bootstrap_mode": true
  }
}
